1,26,1,0.0,0.0,0.0,0.0,0.0,0.0,0.0,0.0,0.0,0.0,0.0,0.0,0.0,0.0,0.0,0.0,0.0,0.0,0.0,0.0,0.0,0.0,0.0,0.0,0.0,0.0,0.0,0.0,0.0,0.0,0.0,0.0,0.0,0.0,0.0,0.0,0.0,0.0,0.0,0.0,0.0,0.0,0.0,0.0,0.0,0.0,0.0,0.0,0.0,0.0,0.0,0.0,0.0,0.0,0.0,0.0,0.0,0.0,0.0,0.0,0.0,0.0,0.0,0.0,0.0,0.0,0.0,0.0,0.0,0.0,0.0,0.0,1.0,1.0,0.0,0.0,0.0,0.0,0.0,0.0,0.0,0.0,0.0,0.0,0.0,0.0,0.0,0.0,0.0,0.0,0.0,0.0,0.0,0.0,0.0,0.0,0.0,0.0,0.0,0.0,32,32,0.0,0.0,1,1,0,0,0.0,0.0,0.0,0.0,0.0,0.0,0.0,0.0,0.0,0.0,0.0,0.0,0,0,0,0,0,0,0,0,0,0,0,0,0,0,0,0,0,0,20,adecreaseinactivityaofthenuclidesintheeffectivevolumewillresultinadecreaseintheunittimecountthisconditionisthebasicprincipleofusingpositronannihilation,A decrease in activity A of the nuclides in the effective volume will result in a decrease in the unit time count. This condition is the basic principle of using positron annihilation.,p,32,ParaText,1,0,0,0,0,0.0,missing,11.0,11.0,0,smissing,missing,missing,missing,0.0,0.0,0.0,0.0,0.0,A decrease in activity A of the nuclides in the effective volume will result in a decrease in the unit time count.,2,22,0,0,0,0,0,0,0.062,0,0,0,0,0,0,0,0,0,0,0,0,0,0,0,0,0,0,Paratext,missing,140,2,0,114,0,0,missing,missing,p,p,missing,missing,Paratext,Paratext,missing,missing,1.0,1.0,1.0,13.0,0.0,0.0,0.0,0.0,0.0,0.0,0.0,0.0,ParaText,0.99092495
1,28,1,0.0,0.0,0.0,0.0,0.0,0.0,0.0,0.0,0.0,0.0,0.0,0.0,0.0,0.0,0.0,0.0,0.0,0.0,0.0,0.0,0.0,0.0,0.0,0.0,0.0,0.0,0.0,0.0,0.0,0.0,0.0,0.0,0.0,0.0,0.0,0.0,0.0,0.0,0.0,0.0,0.0,0.0,0.0,0.0,0.0,0.0,0.0,0.0,0.0,0.0,0.0,0.0,0.0,0.0,0.0,0.0,0.0,0.0,0.0,0.0,0.0,0.0,0.0,0.0,0.0,0.0,0.0,0.0,0.0,0.0,0.0,0.0,1.0,1.0,0.0,0.0,0.0,0.0,0.0,0.0,0.0,0.0,0.0,0.0,0.0,0.0,0.0,0.0,0.0,0.0,0.0,0.0,0.0,0.0,0.0,0.0,0.0,0.0,0.0,0.0,13,13,0.0,0.0,1,1,0,0,0.0,0.0,0.0,0.0,0.0,0.0,0.0,0.0,0.0,0.0,0.0,0.0,0,0,0,0,0,0,0,0,0,0,0,0,0,0,0,0,0,0,21,designofmeasurementschemeforimpuritycontentinpipelinesusingpositronannihilationtechnology,Design of measurement scheme for impurity content in pipelines using positron annihilation technology,p,13,ParaText,1,0,0,0,0,0.0,missing,11.0,11.0,0,smissing,missing,missing,missing,0.0,0.0,0.0,0.0,0.0,Design of measurement scheme for impurity content in pipelines using positron annihilation technology,1,13,0,0,0,0,0,0,0.0,0,0,0,0,0,0,0,0,0,0,0,0,0,0,0,0,0,0,Paratext,missing,140,2,1,101,0,0,missing,missing,p,p,missing,missing,Paratext,Paratext,missing,missing,1.0,1.0,32.0,61.0,0.0,0.0,0.0,0.0,0.0,0.0,0.0,0.0,ParaText,0.99627626
1,30,1,0.0,0.0,0.0,0.0,0.0,0.0,0.0,0.0,0.0,0.0,0.0,0.0,0.0,0.0,0.0,0.0,0.0,0.0,0.0,0.0,0.0,0.0,0.0,0.0,0.0,0.0,0.0,0.0,0.0,0.0,0.0,0.0,0.0,0.0,0.0,0.0,0.0,0.0,0.0,0.0,0.0,0.0,0.0,0.0,0.0,0.0,0.0,0.0,0.0,0.0,0.0,0.0,0.0,0.0,0.0,0.0,0.0,0.0,0.0,0.0,0.0,0.0,0.0,0.0,0.0,0.0,0.0,0.0,0.0,0.0,0.0,0.0,1.0,1.0,0.0,0.0,0.0,0.0,0.0,0.0,0.0,0.0,0.0,0.0,0.0,0.0,0.0,0.0,0.0,0.0,0.0,0.0,0.0,0.0,0.0,0.0,0.0,0.0,0.0,0.0,61,61,0.0,0.0,1,1,0,0,0.0,0.0,0.0,0.0,0.0,0.0,0.0,0.0,0.0,0.0,0.0,0.0,0,0,0,0,0,0,0,0,0,0,0,0,0,0,0,0,0,0,22,theactivityofradioactivepositronnuclidessuchas18fisaffectednotonlybythecontentofimpuritiesbutalsoitsowndecayoncethenuclideisproducedintheacceleratoritwilldecayspontaneouslywithtimeanditsactivitywilldecreasethissituationwillmakethedetectionverydifficultinpracticalapplicationsthethreefollowingproblemsneedtobesolved,"The activity of radioactive positron nuclides (such as 18F) is affected not only by the content of impurities but also its own decay. Once the nuclide is produced in the accelerator, it will decay spontaneously with time, and its activity will decrease. This situation will make the detection very difficult. In practical applications, the three following problems need to be solved:",p,61,ParaText,1,0,0,0,0,0.0,missing,11.0,11.0,0,smissing,missing,missing,missing,0.0,0.0,0.0,0.0,0.0,The activity of radioactive positron nuclides (such as 18F) is affected not only by the content of impurities but also its own decay.,4,23,0,1,0,0,0,0,0.034,0,0,0,0,0,0,0,0,0,0,0,0,0,0,0,0,0,0,Paratext,missing,140,2,0,133,0,0,missing,missing,p,p,missing,missing,Paratext,Paratext,missing,missing,1.0,1.0,13.0,39.0,0.0,0.0,0.0,0.0,0.0,1.0,0.0,0.0,ParaText,0.9988825
1,32,1,0.0,0.0,0.0,0.0,0.0,0.0,0.0,0.0,0.0,0.0,0.0,0.0,0.0,0.0,0.0,0.0,0.0,0.0,0.0,0.0,0.0,0.0,0.0,0.0,0.0,0.0,0.0,0.0,0.0,0.0,0.0,0.0,0.0,0.0,0.0,0.0,0.0,0.0,0.0,0.0,0.0,0.0,0.0,0.0,0.0,0.0,0.0,0.0,0.0,0.0,0.0,0.0,0.0,0.0,0.0,0.0,0.0,0.0,0.0,0.0,0.0,0.0,0.0,0.0,0.0,0.0,0.0,0.0,0.0,0.0,0.0,0.0,1.0,1.0,0.0,0.0,0.0,0.0,0.0,0.0,0.0,0.0,0.0,0.0,0.0,0.0,0.0,0.0,0.0,0.0,0.0,0.0,0.0,0.0,0.0,0.0,0.0,0.0,0.0,0.0,39,39,0.0,0.0,1,1,0,0,0.0,0.0,0.0,0.0,0.0,0.0,0.0,0.0,0.0,0.0,0.0,0.0,0,0,0,0,0,0,0,0,0,0,0,0,0,0,0,0,0,0,23,1themarkoftheliquidshouldbethemarkoftheworkingmediumforexamplethelubricatingoilinthepipelineshouldbemarkedorasolventsolubleinlubricatingoilshouldbeusedandnondestructivefortesting,"1) The mark of the liquid should be the mark of the working medium. For example, the lubricating oil in the pipeline should be marked, or a solvent soluble in lubricating oil should be used and nondestructive for testing.",p,39,ParaText,1,0,0,0,1,0.0,missing,11.0,11.0,0,smissing,missing,missing,missing,0.0,0.0,0.0,0.0,0.0, The mark of the liquid should be the mark of the working medium.,2,13,0,0,0,0,0,0,0.0,0,0,0,0,0,0,0,0,0,0,0,0,1,0,0,0,0,0,Paratext,missing,140,2,0,65,1,0,missing,missing,p,p,missing,missing,Paratext,Paratext,missing,missing,1.0,1.0,61.0,7.0,0.0,0.0,0.0,0.0,0.0,1.0,0.0,0.0,ParaText,0.99052995
1,34,1,0.0,0.0,0.0,0.0,0.0,0.0,0.0,0.0,0.0,0.0,0.0,0.0,0.0,0.0,0.0,0.0,0.0,0.0,0.0,0.0,0.0,0.0,0.0,0.0,0.0,0.0,0.0,0.0,0.0,0.0,0.0,0.0,0.0,0.0,0.0,0.0,0.0,0.0,0.0,0.0,0.0,0.0,0.0,0.0,0.0,0.0,0.0,0.0,0.0,0.0,0.0,0.0,0.0,0.0,0.0,0.0,0.0,0.0,0.0,0.0,0.0,0.0,0.0,0.0,0.0,0.0,0.0,0.0,0.0,0.0,0.0,0.0,1.0,1.0,0.0,0.0,0.0,0.0,0.0,0.0,0.0,0.0,0.0,0.0,0.0,0.0,0.0,0.0,0.0,0.0,0.0,0.0,0.0,0.0,0.0,0.0,0.0,0.0,0.0,0.0,7,7,0.0,0.0,1,1,0,0,0.0,0.0,0.0,0.0,0.0,0.0,0.0,0.0,0.0,0.0,0.0,0.0,0,0,0,0,0,0,0,0,0,0,0,0,0,0,0,0,0,0,24,2effectivevolumecontrolshouldbeapplied,2) Effective volume control should be applied.,p,7,ParaText,1,0,0,0,1,0.0,missing,11.0,11.0,0,smissing,missing,missing,missing,0.0,0.0,0.0,0.0,0.0, Effective volume control should be applied.,1,6,0,0,0,0,0,0,0.0,0,0,0,0,0,0,0,0,0,0,0,0,1,0,0,0,0,0,Paratext,missing,140,2,1,44,1,1,missing,missing,p,p,missing,missing,Paratext,Paratext,missing,missing,1.0,1.0,39.0,26.0,0.0,0.0,0.0,0.0,1.0,1.0,0.0,0.0,ParaText,0.99409276
1,36,1,0.0,0.0,0.0,0.0,0.0,0.0,0.0,0.0,0.0,0.0,0.0,0.0,0.0,0.0,0.0,0.0,0.0,0.0,0.0,0.0,0.0,0.0,0.0,0.0,0.0,0.0,0.0,0.0,0.0,0.0,0.0,0.0,0.0,0.0,0.0,0.0,0.0,0.0,0.0,0.0,0.0,0.0,0.0,0.0,0.0,0.0,0.0,0.0,0.0,0.0,0.0,0.0,0.0,0.0,0.0,0.0,0.0,0.0,0.0,0.0,0.0,0.0,0.0,0.0,0.0,0.0,0.0,0.0,0.0,0.0,0.0,0.0,1.0,1.0,0.0,0.0,0.0,0.0,0.0,0.0,0.0,0.0,0.0,0.0,0.0,0.0,0.0,0.0,0.0,0.0,0.0,0.0,0.0,0.0,0.0,0.0,0.0,0.0,0.0,0.0,26,26,0.0,0.0,1,1,0,0,0.0,0.0,0.0,0.0,0.0,0.0,0.0,0.0,0.0,0.0,0.0,0.0,0,0,0,0,0,0,0,0,0,0,0,0,0,0,0,0,0,0,25,3sensordataincludingnuclideactivitychangestheinfluenceofenvironmentalparametersanddetectionefficiencyandconsistencyofthesensorshouldbeprocessedforsuccessfuldetection,"3) Sensor data, including nuclide activity changes, the influence of environmental parameters, and detection efficiency and consistency of the sensor, should be processed for successful detection.",p,26,ParaText,1,0,0,0,1,0.0,missing,11.0,11.0,0,smissing,missing,missing,missing,0.0,0.0,0.0,0.0,0.0," Sensor data, including nuclide activity changes, the influence of environmental parameters, and detection efficiency and consistency of the sensor, should be processed for successful detection.",1,25,0,0,0,0,0,0,0.062,0,0,0,0,0,0,0,0,0,0,0,0,1,0,0,0,0,0,Paratext,missing,140,2,0,194,0,0,missing,missing,p,p,missing,missing,Paratext,Paratext,missing,missing,1.0,1.0,7.0,8.0,0.0,0.0,0.0,0.0,1.0,0.0,0.0,0.0,ParaText,0.9969441
1,38,1,0.0,0.0,0.0,0.0,0.0,0.0,0.0,0.0,0.0,0.0,0.0,0.0,0.0,0.0,0.0,0.0,0.0,0.0,0.0,0.0,0.0,0.0,0.0,0.0,0.0,0.0,0.0,0.0,0.0,0.0,0.0,0.0,0.0,0.0,0.0,0.0,0.0,0.0,0.0,0.0,0.0,0.0,0.0,0.0,0.0,0.0,0.0,0.0,0.0,0.0,0.0,0.0,0.0,0.0,0.0,0.0,0.0,0.0,0.0,0.0,0.0,0.0,0.0,0.0,0.0,0.0,0.0,0.0,0.0,0.0,0.0,0.0,1.0,1.0,0.0,0.0,0.0,0.0,0.0,0.0,0.0,0.0,0.0,0.0,0.0,0.0,0.0,0.0,0.0,0.0,0.0,0.0,0.0,0.0,0.0,0.0,0.0,0.0,0.0,0.0,8,8,0.0,0.0,1,1,0,0,0.0,0.0,0.0,0.0,0.0,0.0,0.0,0.0,0.0,0.0,0.0,0.0,0,0,0,0,0,0,0,0,0,0,0,0,0,0,0,0,0,0,26,forthesethreeproblemsthreesolutionsareproposed,"For these three problems, three solutions are proposed:",p,8,ParaText,1,0,0,0,0,0.0,missing,11.0,11.0,0,smissing,missing,missing,missing,0.0,0.0,0.0,0.0,0.0,"For these three problems, three solutions are proposed:",1,8,0,1,8,0,0,0,0.0,0,0,0,0,0,0,0,0,0,0,0,0,0,0,0,0,0,0,Paratext,missing,140,2,1,55,1,1,missing,missing,p,p,missing,missing,Paratext,Paratext,missing,missing,1.0,1.0,26.0,33.0,0.0,0.0,0.0,0.0,1.0,1.0,0.0,0.0,ParaText,0.99909174
1,40,1,0.0,0.0,0.0,0.0,0.0,0.0,0.0,0.0,0.0,0.0,0.0,0.0,0.0,0.0,0.0,0.0,0.0,0.0,0.0,0.0,0.0,0.0,0.0,0.0,0.0,0.0,0.0,0.0,0.0,0.0,0.0,0.0,0.0,0.0,0.0,0.0,0.0,0.0,0.0,0.0,0.0,0.0,0.0,0.0,0.0,0.0,0.0,0.0,0.0,0.0,0.0,0.0,0.0,0.0,0.0,0.0,0.0,0.0,0.0,0.0,0.0,0.0,0.0,0.0,0.0,0.0,0.0,0.0,0.0,0.0,0.0,0.0,1.0,1.0,0.0,0.0,0.0,0.0,0.0,0.0,0.0,0.0,0.0,0.0,0.0,0.0,0.0,0.0,0.0,0.0,0.0,0.0,0.0,0.0,0.0,0.0,0.0,0.0,0.0,0.0,33,33,0.0,0.0,1,1,0,0,0.0,0.0,0.0,0.0,0.0,0.0,0.0,0.0,0.0,0.0,0.0,0.0,0,0,0,0,0,0,0,0,0,0,0,0,0,0,0,0,0,0,27,1theliquidinthepipelineshouldbelabelledwithnuclidegenerallygasolinethatsatisfiescnh2n2iscompatiblewithenginelubricatingoilandiseasytoobtainthisexperimentusescnh2n2,"1) The liquid in the pipeline should be labelled with nuclide. Generally, gasoline that satisfies CnH2n+2 is compatible with engine lubricating oil and is easy to obtain. This experiment uses CnH2n+2.",p,33,ParaText,1,0,0,0,1,0.0,missing,11.0,11.0,0,smissing,missing,missing,missing,0.0,0.0,0.0,0.0,0.0, The liquid in the pipeline should be labelled with nuclide.,3,10,0,0,0,0,0,0,0.158,0,0,0,0,0,0,0,0,0,0,0,0,1,0,0,0,0,0,Paratext,missing,140,2,0,60,1,0,missing,missing,p,p,missing,missing,Paratext,Paratext,missing,missing,1.0,1.0,8.0,64.0,0.0,0.0,0.0,0.0,0.0,1.0,0.0,0.0,ParaText,0.99728715
1,42,1,0.0,0.0,0.0,0.0,0.0,0.0,0.0,0.0,0.0,0.0,0.0,0.0,0.0,0.0,0.0,0.0,0.0,0.0,0.0,0.0,0.0,0.0,0.0,0.0,0.0,0.0,0.0,0.0,0.0,0.0,0.0,0.0,0.0,0.0,0.0,0.0,0.0,0.0,0.0,0.0,0.0,0.0,0.0,0.0,0.0,0.0,0.0,0.0,0.0,0.0,0.0,0.0,0.0,0.0,0.0,0.0,0.0,0.0,0.0,0.0,0.0,0.0,0.0,0.0,0.0,0.0,0.0,0.0,0.0,0.0,0.0,0.0,1.0,1.0,0.0,0.0,0.0,0.0,0.0,0.0,0.0,0.0,0.0,0.0,0.0,0.0,0.0,0.0,0.0,0.0,0.0,0.0,0.0,0.0,0.0,0.0,0.0,0.0,0.0,0.0,64,64,0.0,0.0,1,1,0,0,0.0,0.0,0.0,0.0,0.0,0.0,0.0,0.0,0.0,0.0,0.0,0.0,0,0,0,0,0,0,0,0,0,0,0,0,0,0,0,0,0,0,28,2theeffectivevolumeshouldbecontrolledinthispaperthesensorisplacedparalleltothetesttubeandaleadblockisplacedabovethesensortoisolatetheeffectsofpositronsemittedobliquelyabovemoreovertheheightoftheliquidcolumnismuchgreaterthantheheightofthesensortoavoiderrorscausedbythedifferenceinliquidcolumnheight,"2) The effective volume should be controlled. In this paper, the sensor is placed parallel to the test tube, and a lead block is placed above the sensor to isolate the effects of positrons emitted obliquely above. Moreover, the height of the liquid column is much greater than the height of the sensor to avoid errors caused by the difference in liquid column height.",p,64,ParaText,1,0,0,0,1,0.0,missing,11.0,11.0,0,smissing,missing,missing,missing,0.0,0.0,0.0,0.0,0.0, The effective volume should be controlled.,3,6,0,0,0,0,0,0,0.0,0,0,0,0,0,0,0,0,0,0,0,0,1,0,0,0,0,0,Paratext,missing,140,2,0,43,1,0,missing,missing,p,p,missing,span,Paratext,Paratext,missing,Paratext,1.0,2.0,33.0,54.0,0.0,0.0,0.0,0.0,1.0,1.0,0.0,0.0,ParaText,0.99753773
1,44,2,0.0,0.0,0.0,0.0,0.0,0.0,0.0,0.0,0.0,0.0,0.0,0.0,0.0,0.0,0.0,0.0,0.0,0.0,0.0,0.0,0.0,0.0,0.0,0.0,0.0,0.0,0.0,0.0,0.0,0.0,0.0,0.0,0.0,0.0,0.0,0.0,0.0,0.0,0.0,0.0,0.0,0.0,0.0,0.0,0.0,0.0,0.0,0.0,0.0,0.0,0.0,0.0,0.0,0.0,0.0,0.0,0.0,0.0,0.0,0.0,0.0,0.0,0.0,0.0,0.0,0.0,0.0,0.0,0.0,0.0,0.0,0.0,1.0,0.0,0.0,0.0,0.0,0.0,1.0,0.0,0.0,0.0,0.0,0.0,0.0,0.0,0.0,0.0,0.0,0.0,0.0,0.0,0.0,0.0,0.0,0.0,0.0,0.0,0.0,0.0,54,1,0.0,0.0,1,1,0,0,0.0,0.0,0.0,0.0,0.0,0.0,0.0,0.0,0.0,0.0,0.0,0.0,0,0,0,0,0,0,0,0,0,0,0,0,0,0,0,0,0,0,29,3thesensordatashouldbeprocessedinthispaperacomparisontestoftheexperimentalbranchcontainingimpuritiesandthereferencebranchwithoutimpuritiesisdesignedtoreducetheeffectofthesecomprehensivefactorsondetectionusingtwomatchedsensorsfordetectionsymmetricalstructureandratiomeasurementareproposedtoreducemeasurementerrors,"3) The sensor data should be processed. In this paper, a comparison test of the experimental branch (containing impurities) and the reference branch (without impurities) is designed to reduce the effect of these comprehensive factors on detection. Using two matched sensors for detection, symmetrical structure and ratio measurement are proposed to reduce measurement errors.",p,54,ParaText,1,0,0,0,1,0.0,missing,11.0,11.0,0,two,span,ParaText,missing,1.0,0.0,0.0,0.0,1.0, The sensor data should be processed.,3,6,0,0,0,0,0,0,0.0,0,0,0,0,0,0,0,0,0,0,0,0,1,0,0,0,0,0,Paratext,Paratext,140,2,0,37,1,0,missing,missing,p,p,missing,missing,Paratext,Paratext,missing,missing,1.0,1.0,64.0,7.0,0.0,0.0,0.0,0.0,1.0,0.0,0.0,0.0,ParaText,0.98598677
1,46,1,0.0,0.0,0.0,0.0,0.0,0.0,0.0,0.0,0.0,0.0,0.0,0.0,0.0,0.0,0.0,0.0,0.0,0.0,0.0,0.0,0.0,0.0,0.0,0.0,0.0,0.0,0.0,0.0,0.0,0.0,0.0,0.0,0.0,0.0,0.0,0.0,0.0,0.0,0.0,0.0,0.0,0.0,0.0,0.0,0.0,0.0,0.0,0.0,0.0,0.0,0.0,0.0,0.0,0.0,0.0,0.0,0.0,0.0,0.0,0.0,0.0,0.0,0.0,0.0,0.0,0.0,0.0,0.0,0.0,0.0,0.0,0.0,1.0,1.0,0.0,0.0,0.0,0.0,0.0,0.0,0.0,0.0,0.0,0.0,0.0,0.0,0.0,0.0,0.0,0.0,0.0,0.0,0.0,0.0,0.0,0.0,0.0,0.0,0.0,0.0,7,7,0.0,0.0,1,1,0,0,0.0,0.0,0.0,0.0,0.0,0.0,0.0,0.0,0.0,0.0,0.0,0.0,0,0,0,0,0,0,0,0,0,0,0,0,0,0,0,0,0,0,31,designofdeviceformeasuringimpuritycontent,Design of device for measuring impurity content,p,7,ParaText,1,0,0,0,0,0.0,missing,11.0,11.0,0,smissing,missing,missing,missing,0.0,0.0,0.0,0.0,0.0,Design of device for measuring impurity content,1,7,0,0,0,0,0,0,0.0,0,0,0,0,0,0,0,0,0,0,0,0,0,0,0,0,0,0,Paratext,missing,140,2,1,47,1,1,missing,missing,p,p,span,span,Paratext,Paratext,Paratext,others,2.0,3.0,54.0,207.0,0.0,0.0,0.0,0.0,1.0,0.0,0.0,0.0,ParaText,0.991876
1,48,3,1.0,0.0,0.0,0.0,0.0,0.0,0.0,0.0,0.0,0.0,0.0,0.0,0.0,0.0,0.0,0.0,0.0,0.0,0.0,0.0,0.0,0.0,0.0,0.0,0.0,0.0,0.0,0.0,0.0,0.0,0.0,0.0,0.0,0.0,0.0,0.0,0.0,0.0,0.0,0.0,0.0,0.0,0.0,0.0,0.0,0.0,0.0,0.0,0.0,0.0,0.0,0.0,0.0,0.0,0.0,0.0,0.0,0.0,0.0,0.0,0.0,0.0,0.0,0.0,0.0,0.0,0.0,0.0,0.0,0.0,0.0,0.0,1.0,0.0,0.0,0.0,0.0,0.0,1.0,0.0,0.0,0.0,0.0,0.0,0.0,0.0,0.0,0.0,0.0,0.0,0.0,0.0,0.0,0.0,0.0,0.0,0.0,0.0,0.0,0.0,207,1,0.0,0.0,1,0,1,0,0.0,0.0,0.0,0.0,0.0,0.0,0.0,0.0,0.0,0.0,0.0,0.0,0,0,0,0,0,0,0,0,0,0,0,0,0,0,0,0,0,0,32,theschematicofthemeasurementdeviceforimpuritiesintheenginepipelinebasedonpositronannihilationisshowninfigure2theapparatusincludedadetectingpipelineassemblyandaphotondetectingapparatusthedetectionpipelineassemblyconsistedofanaccesspipelineanexperimentalbranchareferencebranchandanoutgoingpipelineduringthedetectionofthedevicetheradionuclidesolubleinlubricatingoilwithacertainactivitywascompletelymixedwithenginelubricatingoilandinjectedintothedetectionpipelineassemblythenumberofphotonresponselinesintheexperimentalbranchofphotondetectiondevicewascomparedwiththatinthebranchanddataprocessingwascarriedouttoobtainthecontentofimpuritiesinthepipelinethereferencebranchinthedevicewasdesignedasareferenceformeasurementtheexperimentalandreferencebranchesshouldbemadeofthesamematerialsandtheoilflowingthroughthebranchshouldbefreefromimpuritiesthusafilterscreenwasaddedattheentranceofthereferencebranchroadtoblockparticlestheangleoffilterscreenallowedtheflowinglubricatingoiltoremovetheparticlesdepositednearthefilterforensuringthesmoothflowoflubricatingoilwithoutimpuritiesthroughthebranchroad,"The schematic of the measurement device for impurities in the engine pipeline based on positron annihilation is shown in Figure 2. The apparatus included a detecting pipeline assembly and a γ photon detecting apparatus. The detection pipeline assembly consisted of an access pipeline, an experimental branch, a reference branch, and an outgoing pipeline. During the detection of the device, the radionuclide soluble in lubricating oil with a certain activity was completely mixed with engine lubricating oil and injected into the detection pipeline assembly. The number of γ photon response lines in the experimental branch of γ photon detection device was compared with that in the branch, and data processing was carried out to obtain the content of impurities in the pipeline. The reference branch in the device was designed as a reference for measurement. The experimental and reference branches should be made of the same materials, and the oil flowing through the branch should be free from impurities. Thus, a filter screen was added at the entrance of the reference branch road to block particles. The angle of filter screen allowed the flowing lubricating oil to remove the particles deposited near the filter for ensuring the smooth flow of lubricating oil without impurities through the branch road.",p,207,ParaText,1,0,0,0,0,0.0,missing,11.0,11.0,0,Figure 2,span,FigureCallout,missing,2.0,0.0,0.0,0.0,1.0,The schematic of the measurement device for impurities in the engine pipeline based on positron annihilation is shown in Figure 2.,4,21,0,0,0,0,0,0,0.028,1,0,0,0,0,0,0,0,0,0,0,1,0,0,0,0,0,0,Paratext,others,140,2,0,130,0,0,missing,missing,p,p,missing,span,Paratext,Paratext,missing,others,1.0,3.0,7.0,110.0,0.0,0.0,0.0,0.0,0.0,0.0,0.0,0.0,ParaText,0.99935037
1,50,3,1.0,0.0,0.0,0.0,0.0,0.0,0.0,0.0,0.0,0.0,0.0,0.0,0.0,0.0,0.0,0.0,0.0,0.0,0.0,0.0,0.0,0.0,0.0,0.0,0.0,0.0,0.0,0.0,0.0,0.0,0.0,0.0,0.0,0.0,0.0,0.0,0.0,0.0,0.0,0.0,0.0,0.0,0.0,0.0,0.0,0.0,0.0,0.0,0.0,0.0,0.0,0.0,0.0,0.0,0.0,0.0,0.0,0.0,0.0,0.0,0.0,0.0,0.0,0.0,0.0,0.0,0.0,0.0,0.0,0.0,0.0,0.0,1.0,0.0,0.0,0.0,0.0,0.0,1.0,0.0,0.0,0.0,0.0,0.0,0.0,0.0,0.0,0.0,0.0,0.0,0.0,0.0,0.0,0.0,0.0,0.0,0.0,0.0,0.0,0.0,110,1,0.0,0.0,0,0,1,0,0.0,0.0,0.0,0.0,0.0,0.0,0.0,0.0,0.0,0.0,0.0,0.0,0,0,0,0,0,0,0,0,0,0,0,0,0,0,0,0,0,0,35,twopairsofsensorswereinstalledbecausethisexperimentoriginallyplannedtousethemethodofmeasuringtheresponselinetodetectthecontentofimpuritieshoweverinactualoperationwefoundthatonlyusingapairofsensorstodetectthenumberofphotoneventscancompletethedetectionofimpuritycontentalthoughtheexperimentalschemewasmodifiedtheoriginaldetectionmodelcancontinuetobeusedbecauseonlyapairofsensorscanbeusedfordetectiontheexperimentaldeviceformeasuringimpuritycontentinthepipelinewasdesignedinaccordancewiththeaboverequirementstoverifythefeasibilityoftheproposedschemeasshowninfigure3,"Two pairs of sensors were installed because this experiment originally planned to use the method of measuring the response line to detect the content of impurities. However, in actual operation, we found that only using a pair of sensors to detect the number of photon events can complete the detection of impurity content. Although the experimental scheme was modified, the original detection model can continue to be used because only a pair of sensors can be used for detection. The experimental device for measuring impurity content in the pipeline was designed in accordance with the above requirements to verify the feasibility of the proposed scheme, as shown in Figure 3.",p,110,ParaText,0,0,0,0,0,0.0,missing,11.0,11.0,0,Figure 3,span,FigureCallout,missing,2.0,0.0,0.0,0.0,1.0,Two pairs of sensors were installed because this experiment originally planned to use the method of measuring the response line to detect the content of impurities.,3,26,0,0,0,0,0,0,0.0,0,0,0,0,0,0,0,0,0,0,0,0,0,0,0,0,0,0,Paratext,others,140,2,0,164,0,0,missing,missing,p,p,span,missing,Paratext,Paratext,others,missing,3.0,1.0,207.0,10.0,0.0,0.0,0.0,0.0,0.0,0.0,0.0,0.0,ParaText,0.99843925
1,52,1,0.0,0.0,0.0,0.0,0.0,0.0,0.0,0.0,0.0,0.0,0.0,0.0,0.0,0.0,0.0,0.0,0.0,0.0,0.0,0.0,0.0,0.0,0.0,0.0,0.0,0.0,0.0,0.0,0.0,0.0,0.0,0.0,0.0,0.0,0.0,0.0,0.0,0.0,0.0,0.0,0.0,0.0,0.0,0.0,0.0,0.0,0.0,0.0,0.0,0.0,0.0,0.0,0.0,0.0,0.0,0.0,0.0,0.0,0.0,0.0,0.0,0.0,0.0,0.0,0.0,0.0,0.0,0.0,0.0,0.0,0.0,0.0,1.0,1.0,0.0,0.0,0.0,0.0,0.0,0.0,0.0,0.0,0.0,0.0,0.0,0.0,0.0,0.0,0.0,0.0,0.0,0.0,0.0,0.0,0.0,0.0,0.0,0.0,0.0,0.0,10,10,0.0,0.0,1,1,0,0,0.0,0.0,0.0,0.0,0.0,0.0,0.0,0.0,0.0,0.0,0.0,0.0,0,0,0,0,0,0,0,0,0,0,0,0,0,0,0,0,0,0,38,designofanalysismethodofdetectionresultbyratiomethod,Design of analysis method of detection result by ratio method,p,10,ParaText,1,0,0,0,0,0.0,missing,11.0,11.0,0,smissing,missing,missing,missing,0.0,0.0,0.0,0.0,0.0,Design of analysis method of detection result by ratio method,1,10,0,0,0,0,0,0,0.0,0,0,0,0,0,0,0,0,0,0,0,0,0,0,0,0,0,0,Paratext,missing,140,2,1,61,1,1,missing,missing,p,p,span,missing,Paratext,Paratext,others,missing,3.0,1.0,110.0,71.0,0.0,0.0,0.0,0.0,0.0,0.0,0.0,0.0,ParaText,0.9571716
1,54,1,0.0,0.0,0.0,0.0,0.0,0.0,0.0,0.0,0.0,0.0,0.0,0.0,0.0,0.0,0.0,0.0,0.0,0.0,0.0,0.0,0.0,0.0,0.0,0.0,0.0,0.0,0.0,0.0,0.0,0.0,0.0,0.0,0.0,0.0,0.0,0.0,0.0,0.0,0.0,0.0,0.0,0.0,0.0,0.0,0.0,0.0,0.0,0.0,0.0,0.0,0.0,0.0,0.0,0.0,0.0,0.0,0.0,0.0,0.0,0.0,0.0,0.0,0.0,0.0,0.0,0.0,0.0,0.0,0.0,0.0,0.0,0.0,1.0,1.0,0.0,0.0,0.0,0.0,0.0,0.0,0.0,0.0,0.0,0.0,0.0,0.0,0.0,0.0,0.0,0.0,0.0,0.0,0.0,0.0,0.0,0.0,0.0,0.0,0.0,0.0,71,71,0.0,0.0,1,1,0,0,0.0,0.0,0.0,0.0,0.0,0.0,0.0,0.0,0.0,0.0,0.0,0.0,0,0,0,0,0,0,0,0,0,0,0,0,0,0,0,0,0,0,39,theratiomethodofthesensordataofthetwobrancheswasusedtoeliminatetheerrorbecausethenuclideactivityoftheexperimentalbranchandthereferencebranchdecreaseswithtimetoeliminatetheinfluenceoftimeandseveralenvironmentalfactorstheratiocalibrateddatawerefittedtocalibratetheimpuritycontentcorrespondingtotheratioofdifferentphotoneventsandexploretherelationshipbetweensensordataandimpuritycontent,The ratio method of the sensor data of the two branches was used to eliminate the error because the nuclide activity of the experimental branch and the reference branch decreases with time to eliminate the influence of time and several environmental factors. The ratio-calibrated data were fitted to calibrate the impurity content corresponding to the ratio of different photon events and explore the relationship between sensor data and impurity content.,p,71,ParaText,1,0,0,0,0,0.0,missing,11.0,11.0,0,smissing,missing,missing,missing,0.0,0.0,0.0,0.0,0.0,The ratio method of the sensor data of the two branches was used to eliminate the error because the nuclide activity of the experimental branch and the reference branch decreases with time to eliminate the influence of time and several environmental factors.,2,42,0,0,0,0,0,0,0.0,0,0,0,0,0,0,0,0,0,0,0,0,0,0,0,0,0,0,Paratext,missing,140,2,0,258,0,0,missing,missing,p,p,missing,missing,Paratext,Paratext,missing,missing,1.0,1.0,10.0,9.0,0.0,0.0,0.0,0.0,0.0,0.0,0.0,0.0,ParaText,0.984209
1,56,1,0.0,0.0,0.0,0.0,0.0,0.0,0.0,0.0,0.0,0.0,0.0,0.0,0.0,0.0,0.0,0.0,0.0,0.0,0.0,0.0,0.0,0.0,0.0,0.0,0.0,0.0,0.0,0.0,0.0,0.0,0.0,0.0,0.0,0.0,0.0,0.0,0.0,0.0,0.0,0.0,0.0,0.0,0.0,0.0,0.0,0.0,0.0,0.0,0.0,0.0,0.0,0.0,0.0,0.0,0.0,0.0,0.0,0.0,0.0,0.0,0.0,0.0,0.0,0.0,0.0,0.0,0.0,0.0,0.0,0.0,0.0,0.0,1.0,1.0,0.0,0.0,0.0,0.0,0.0,0.0,0.0,0.0,0.0,0.0,0.0,0.0,0.0,0.0,0.0,0.0,0.0,0.0,0.0,0.0,0.0,0.0,0.0,0.0,0.0,0.0,9,9,0.0,0.0,1,1,0,0,0.0,0.0,0.0,0.0,0.0,0.0,0.0,0.0,0.0,0.0,0.0,0.0,0,0,0,0,0,0,0,0,0,0,0,0,0,0,0,0,0,0,40,theprincipleoftheratiomethodisasfollows,The principle of the ratio method is as follows.,p,9,ParaText,1,0,0,0,0,0.0,missing,11.0,11.0,0,smissing,missing,missing,missing,0.0,0.0,0.0,0.0,0.0,The principle of the ratio method is as follows.,1,9,0,0,0,0,0,0,0.0,0,0,0,0,0,0,0,0,0,0,0,0,0,0,0,0,0,0,Paratext,missing,140,2,1,48,1,1,missing,missing,p,p,missing,missing,Paratext,Paratext,missing,missing,1.0,1.0,71.0,19.0,0.0,0.0,0.0,0.0,0.0,0.0,0.0,0.0,ParaText,0.9927729
1,58,1,0.0,0.0,0.0,0.0,0.0,0.0,0.0,0.0,0.0,0.0,0.0,0.0,0.0,0.0,0.0,0.0,0.0,0.0,0.0,0.0,0.0,0.0,0.0,0.0,0.0,0.0,0.0,0.0,0.0,0.0,0.0,0.0,0.0,0.0,0.0,0.0,0.0,0.0,0.0,0.0,0.0,0.0,0.0,0.0,0.0,0.0,0.0,0.0,0.0,0.0,0.0,0.0,0.0,0.0,0.0,0.0,0.0,0.0,0.0,0.0,0.0,0.0,0.0,0.0,0.0,0.0,0.0,0.0,0.0,0.0,0.0,0.0,1.0,1.0,0.0,0.0,0.0,0.0,0.0,0.0,0.0,0.0,0.0,0.0,0.0,0.0,0.0,0.0,0.0,0.0,0.0,0.0,0.0,0.0,0.0,0.0,0.0,0.0,0.0,0.0,19,19,0.0,0.0,1,1,0,0,0.0,0.0,0.0,0.0,0.0,0.0,0.0,0.0,0.0,0.0,0.0,0.0,0,0,0,0,0,0,0,0,0,0,0,0,0,0,0,0,0,0,41,inaunittimeperiodthetotalnumberofphotonsdetectedbythesensorbasedonequation1is,"In a unit time period, the total number of photons detected by the sensor based on Equation (1) is",p,19,ParaText,1,0,0,0,0,0.0,missing,11.0,11.0,0,smissing,missing,missing,missing,0.0,0.0,0.0,0.0,0.0,"In a unit time period, the total number of photons detected by the sensor based on Equation (1) is",1,19,0,0,0,0,0,0,0.1,0,0,0,0,0,0,0,0,0,0,0,0,0,0,0,0,0,0,Paratext,missing,140,2,1,98,1,1,missing,missing,p,p,missing,missing,Paratext,Paratext,missing,missing,1.0,1.0,9.0,14.0,0.0,0.0,0.0,0.0,0.0,0.0,0.0,0.0,ParaText,0.9911623
